<?xml version="1.0" encoding="UTF-8" ?>
<context xsi:schemaLocation="http://www.hyperadapt.net/pxweave/context ../schemas/context.xsd" xmlns:xsi="http://www.w3.org/2001/XMLSchema-instance" xmlns="http://www.hyperadapt.net/pxweave/context">
<integerParameter>
	<name>hres</name>
	<value>800</value>
</integerParameter>
<integerParameter>
	<name>vres</name>
	<value>600</value>
</integerParameter>
<stringParameter>
	<name>deviceType</name>
	<value>cellPhone</value>
</stringParameter>
</context>